{"schema_version":"aud-verification-result-v1","verification_id":"V-CONTEXT-001","run_id":"RUN-2026-09-04-003","finding_id":"F-2026-09-04-flow-001","implementation_revision":"aaaaaaaaaaaaaaaaaaaaaaaaaaaaaaaaaaaaaaaa","verified_at":"2026-09-04T11:00:00Z","acceptance_results":[{"criterion_id":"AC-001","status":"pass","evidence_refs":["EV-VERIFY-001"],"notes":"Passed."}],"specialist_rechecks":["flow-audit"],"adjacent_regressions":[],"result":"verified","residual_risk":"Other browsers are untested.","evidence_refs":["EV-VERIFY-001"],"status_update":"verified"}
